{
  "schema": "tiger.registry/v1",

  "type": "app",
  "slug": "docs",
  "module": "Documentation",
  "vendor": "WebTigers",

  "repository": "https://github.com/WebTigers/TigerDocs",
  "website": "https://webtigers.com",
  "contact": "support@webtigers.com",

  "version": "0.1.0",
  "ref": "v0.1.0",

  "logo": "https://raw.githubusercontent.com/WebTigers/TigerDocs/v0.1.0/assets/logo.png",
  "hero": "https://raw.githubusercontent.com/WebTigers/TigerDocs/v0.1.0/assets/hero.png",

  "description": "A public documentation site for your Tiger app — organized, searchable help pages rendered in your active theme.",
  "tiger_md": "https://raw.githubusercontent.com/WebTigers/TigerDocs/v0.1.0/TIGER.md",

  "keywords": ["docs", "documentation", "help", "knowledge-base"],
  "category": "Content",
  "license": "MIT",

  "pricing": { "model": "free", "pro_url": null },
  "requires": { "tiger": ">=1.0", "php": ">=8.1" },

  "review": {
    "status": "accepted",
    "reviewed_ref": "v0.1.0",
    "reviewed_at": "2026-07-08",
    "reviewer": "tiger-vendor-bot",
    "notes": "Public repo; valid module.json + TIGER.md; MIT license; release v0.1.0 present; module layout conforms."
  }
}
