{
  "schema": "tiger.registry/v1",

  "type": "theme",
  "slug": "theme-grey-mist",
  "module": "Grey Mist",
  "vendor": "WebTigers",

  "repository": "https://github.com/WebTigers/theme-grey-mist",
  "website": "https://webtigers.com",
  "contact": "support@webtigers.com",

  "version": "0.7.0-beta",
  "ref": "v0.7.0-beta",

  "logo": "media/logo.jpg",
  "hero": "media/hero.jpg",

  "description": "A free, one-page Bootstrap 5 theme for Tiger — self-contained, zero external dependencies, fully editable CSS/JS.",
  "tiger_md": "https://raw.githubusercontent.com/WebTigers/theme-grey-mist/v0.7.0-beta/TIGER.md",

  "keywords": ["theme", "bootstrap", "one-page", "landing", "grayscale", "mit", "responsive"],
  "license": "MIT",

  "pricing": { "model": "free", "pro_url": null },
  "requires": { "tiger": ">=0.5", "php": ">=8.1" },

  "review": {
    "status": "accepted",
    "reviewed_ref": "v0.7.0-beta",
    "reviewed_at": "2026-07-15",
    "reviewer": "tiger-vendor-bot",
    "notes": "Public repo; theme.json + slug match (theme-grey-mist); TIGER.md present; MIT; release v0.7.0-beta present. Directory media (logo + hero) in media/. Screenshots gallery to follow."
  }
}
